{
  "version": 1,
  "command": "policy-check",
  "ok": true,
  "source": "main",
  "policy_path": "tests/fixtures/supervised_workflow/policy.json",
  "summary": {
    "targets": 2,
    "errors": 0
  },
  "targets": [
    {
      "target_id": "fn:main::apply",
      "owner": "human:supervisor",
      "review": "required",
      "known": true,
      "owner_valid": true,
      "review_valid": true,
      "duplicate": false
    },
    {
      "target_id": "fn:main::main",
      "owner": "agent:pair",
      "review": "supervised",
      "known": true,
      "owner_valid": true,
      "review_valid": true,
      "duplicate": false
    }
  ],
  "diagnostics": [
  ]
}
