{
  "version": 1,
  "command": "policy-check",
  "ok": true,
  "source": "app::main",
  "policy_path": "tests/fixtures/organizational_tool/nauqtype.policy.json",
  "summary": {
    "targets": 2,
    "errors": 0
  },
  "targets": [
    {
      "target_id": "workspace:org.operations_tool::module:app::main::fn:main",
      "owner": "human:operations",
      "review": "required",
      "known": true,
      "owner_valid": true,
      "review_valid": true,
      "duplicate": false
    },
    {
      "target_id": "workspace:org.reporting::module:render::fn:status_line",
      "owner": "agent:reporting",
      "review": "supervised",
      "known": true,
      "owner_valid": true,
      "review_valid": true,
      "duplicate": false
    }
  ],
  "diagnostics": [
  ]
}
