{
  "version": 1,
  "command": "policy-check",
  "ok": false,
  "source": "app::main",
  "policy_path": "tests/fixtures/workspace_local_dependency/policy_unknown_workspace.json",
  "summary": {
    "targets": 1,
    "errors": 1
  },
  "targets": [
    {
      "target_id": "workspace:tests.unknown::module:render::fn:answer",
      "owner": "human:release",
      "review": "required",
      "known": false,
      "owner_valid": true,
      "review_valid": true,
      "duplicate": false
    }
  ],
  "diagnostics": [
    {
      "code": "NQ-POLICY-003",
      "message": "unknown policy target: workspace:tests.unknown::module:render::fn:answer"
    }
  ]
}
