{
  "version": 1,
  "command": "policy-check",
  "ok": true,
  "source": "app::main",
  "policy_path": "tests/fixtures/workspace_local_dependency/policy.json",
  "summary": {
    "targets": 2,
    "errors": 0
  },
  "targets": [
    {
      "target_id": "workspace:tests.reporting::module:render::fn:answer",
      "owner": "human:release",
      "review": "required",
      "known": true,
      "owner_valid": true,
      "review_valid": true,
      "duplicate": false
    },
    {
      "target_id": "workspace:tests.workspace_local_dependency::module:app::main::fn:main",
      "owner": "agent:tooling",
      "review": "supervised",
      "known": true,
      "owner_valid": true,
      "review_valid": true,
      "duplicate": false
    }
  ],
  "diagnostics": [
  ]
}
