{
  "version": 1,
  "command": "policy-check",
  "ok": true,
  "source": "main",
  "policy_path": "tests/fixtures/evidence_parity/policy.json",
  "summary": {
    "targets": 5,
    "errors": 0
  },
  "targets": [
    {
      "target_id": "fn:main::score",
      "owner": "human:compiler",
      "review": "required",
      "known": true,
      "owner_valid": true,
      "review_valid": true,
      "duplicate": false
    },
    {
      "target_id": "fn:helper::load_text",
      "owner": "human:compiler",
      "review": "required",
      "known": true,
      "owner_valid": true,
      "review_valid": true,
      "duplicate": false
    },
    {
      "target_id": "field:helper::Box::value",
      "owner": "human:compiler",
      "review": "required",
      "known": true,
      "owner_valid": true,
      "review_valid": true,
      "duplicate": false
    },
    {
      "target_id": "variant:helper::Choice::Use",
      "owner": "human:compiler",
      "review": "required",
      "known": true,
      "owner_valid": true,
      "review_valid": true,
      "duplicate": false
    },
    {
      "target_id": "const:helper::base_score",
      "owner": "human:compiler",
      "review": "required",
      "known": true,
      "owner_valid": true,
      "review_valid": true,
      "duplicate": false
    }
  ],
  "diagnostics": [
  ]
}
